[
  {
    "schema_version": 1,
    "source_id": "SRC-KILIIA-RDA-TG",
    "name": "Izmail District State Administration (Telegram)",
    "source_class": "S1",
    "source_type": "LOCAL_GOVERNMENT_TELEGRAM",
    "url": "https://t.me/IzmailRDA/49971",
    "language": "uk",
    "country": "UA",
    "published_at": null,
    "published_date": "2026-09-27",
    "publication_precision": "DATE_ONLY",
    "retrieved_at": "2026-09-27T12:19:44Z",
    "is_primary": true,
    "is_original": true,
    "evidence_family_id": "EF-KILIIA-RDA",
    "relationship": "ORIGINAL",
    "availability": "PARTIAL",
    "reputation": {
      "status": "INSUFFICIENT_DATA",
      "score": null,
      "sample_size": 0,
      "later_confirmed": 0,
      "false_or_materially_misleading": 0,
      "unresolved": 0
    }
  },
  {
    "schema_version": 1,
    "source_id": "SRC-UA-PRAVDA-KILIIA",
    "name": "Ukrainska Pravda",
    "source_class": "S4",
    "source_type": "NATIONAL_MEDIA",
    "url": "https://www.pravda.com.ua/news/2026/09/27/8055206/index.amp/",
    "language": "uk",
    "country": "UA",
    "published_at": "2026-09-27T00:53:00Z",
    "published_date": "2026-09-27",
    "publication_precision": "EXACT",
    "retrieved_at": "2026-09-27T12:19:44Z",
    "is_primary": false,
    "is_original": false,
    "evidence_family_id": "EF-KILIIA-RDA",
    "relationship": "QUOTES_SOURCE",
    "availability": "ACCESSIBLE",
    "reputation": {
      "status": "NEW",
      "score": null,
      "sample_size": 0,
      "later_confirmed": 0,
      "false_or_materially_misleading": 0,
      "unresolved": 0
    }
  },
  {
    "schema_version": 1,
    "source_id": "SRC-BESSARABIA-KILIIA",
    "name": "Bessarabia.UA",
    "source_class": "S3",
    "source_type": "LOCAL_MEDIA",
    "url": "https://bessarabia.ua/ua/kriminal/vnochi-misto-kiliya-bulo-pid-atakoyu-vorozhyh-bezpilotnykiv/",
    "language": "uk",
    "country": "UA",
    "published_at": "2026-09-27T05:43:00Z",
    "published_date": "2026-09-27",
    "publication_precision": "EXACT",
    "retrieved_at": "2026-09-27T12:19:44Z",
    "is_primary": false,
    "is_original": false,
    "evidence_family_id": "EF-KILIIA-RDA",
    "relationship": "QUOTES_SOURCE",
    "availability": "ACCESSIBLE",
    "reputation": {
      "status": "NEW",
      "score": null,
      "sample_size": 0,
      "later_confirmed": 0,
      "false_or_materially_misleading": 0,
      "unresolved": 0
    }
  },
  {
    "schema_version": 1,
    "source_id": "SRC-UKRINFORM-ODESA-DSNS",
    "name": "Ukrinform",
    "source_class": "S4",
    "source_type": "NATIONAL_NEWS_AGENCY",
    "url": "https://www.ukrinform.ua/rubric-regions/4168456-na-odesini-vnaslidok-ataki-rf-vinikla-masstabna-pozeza-odna-ludina-zaginula-i-dvoe-postrazdali.html",
    "language": "uk",
    "country": "UA",
    "published_at": null,
    "published_date": "2026-09-27",
    "publication_precision": "DATE_ONLY",
    "retrieved_at": "2026-09-27T12:19:44Z",
    "is_primary": false,
    "is_original": false,
    "evidence_family_id": "EF-ODESA-DSNS",
    "relationship": "QUOTES_SOURCE",
    "availability": "ACCESSIBLE",
    "reputation": {
      "status": "NEW",
      "score": null,
      "sample_size": 0,
      "later_confirmed": 0,
      "false_or_materially_misleading": 0,
      "unresolved": 0
    }
  },
  {
    "schema_version": 1,
    "source_id": "SRC-TAGESSCHAU-WADEPHUL-LAVROV",
    "name": "Tagesschau",
    "source_class": "S4",
    "source_type": "PUBLIC_BROADCASTER",
    "url": "https://www.tagesschau.de/ausland/europa/wadephul-treffen-lawrow-100.html",
    "language": "de",
    "country": "DE",
    "published_at": "2026-09-26T19:00:00Z",
    "published_date": "2026-09-26",
    "publication_precision": "EXACT",
    "retrieved_at": "2026-09-27T12:48:36Z",
    "is_primary": false,
    "is_original": false,
    "evidence_family_id": "EF-DE-RU-MEET-LAVROV-DPA",
    "relationship": "QUOTES_SOURCE",
    "availability": "ACCESSIBLE",
    "reputation": {
      "status": "NEW",
      "score": null,
      "sample_size": 0,
      "later_confirmed": 0,
      "false_or_materially_misleading": 0,
      "unresolved": 0
    }
  },
  {
    "schema_version": 1,
    "source_id": "SRC-DEUTSCHLAND-WADEPHUL-LAVROV",
    "name": "deutschland.de / dpa",
    "source_class": "S4",
    "source_type": "WIRE_REPORT_ON_INFORMATION_PORTAL",
    "url": "https://www.deutschland.de/en/news/wadephul-you-have-to-negotiate-with-opponents",
    "language": "en",
    "country": "DE",
    "published_at": "2026-09-27T07:12:22Z",
    "published_date": "2026-09-27",
    "publication_precision": "EXACT",
    "retrieved_at": "2026-09-27T12:48:36Z",
    "is_primary": false,
    "is_original": false,
    "evidence_family_id": "EF-DE-RU-MEET-WADEPHUL-ZDF",
    "relationship": "QUOTES_SOURCE",
    "availability": "ACCESSIBLE",
    "reputation": {
      "status": "NEW",
      "score": null,
      "sample_size": 0,
      "later_confirmed": 0,
      "false_or_materially_misleading": 0,
      "unresolved": 0
    }
  },
  {
    "schema_version": 1,
    "source_id": "SRC-FR-MFA-ENERGY",
    "name": "France Diplomatie",
    "source_class": "S1",
    "source_type": "FOREIGN_MINISTRY_STATEMENT",
    "url": "https://www.diplomatie.gouv.fr/fr/presse-et-ressources/decouvrir-et-informer/actualites/le-ministre-de-l-europe-et-des-affaires-etrangeres-m-jean-noel-barrot-mobilise-la-diplomatie",
    "language": "fr",
    "country": "FR",
    "published_at": null,
    "published_date": "2026-09-26",
    "publication_precision": "DATE_ONLY",
    "retrieved_at": "2026-09-27T12:19:44Z",
    "is_primary": true,
    "is_original": true,
    "evidence_family_id": "EF-FR-MFA-ENERGY",
    "relationship": "ORIGINAL",
    "availability": "ACCESSIBLE",
    "reputation": {
      "status": "INSUFFICIENT_DATA",
      "score": null,
      "sample_size": 0,
      "later_confirmed": 0,
      "false_or_materially_misleading": 0,
      "unresolved": 0
    }
  },
  {
    "schema_version": 1,
    "source_id": "SRC-ANADOLU-FR-ENERGY",
    "name": "Anadolu Agency",
    "source_class": "S4",
    "source_type": "NEWS_AGENCY",
    "url": "https://www.aa.com.tr/fr/politique/france-barrot-r%C3%A9unit-les-ambassadeurs-en-poste-dans-les-pays-strat%C3%A9giques-pour-les-approvisionnements-%C3%A9nerg%C3%A9tiques/4070355",
    "language": "fr",
    "country": "TR",
    "published_at": null,
    "published_date": "2026-09-26",
    "publication_precision": "DATE_ONLY",
    "retrieved_at": "2026-09-27T12:19:44Z",
    "is_primary": false,
    "is_original": false,
    "evidence_family_id": "EF-FR-MFA-ENERGY",
    "relationship": "QUOTES_SOURCE",
    "availability": "ACCESSIBLE",
    "reputation": {
      "status": "NEW",
      "score": null,
      "sample_size": 0,
      "later_confirmed": 0,
      "false_or_materially_misleading": 0,
      "unresolved": 0
    }
  },
  {
    "schema_version": 1,
    "source_id": "SRC-ENERGYRISKIQ-LNG",
    "name": "EnergyRiskIQ",
    "source_class": "S2",
    "source_type": "SPECIALIST_ENERGY_DATA",
    "url": "https://energyriskiq.com/data/europe-lng-supply-demand",
    "language": "en",
    "country": null,
    "published_at": null,
    "published_date": "2026-09-27",
    "publication_precision": "DATE_ONLY",
    "retrieved_at": "2026-09-27T12:19:44Z",
    "is_primary": false,
    "is_original": true,
    "evidence_family_id": "EF-ERIQ-LNG",
    "relationship": "ORIGINAL",
    "availability": "ACCESSIBLE",
    "reputation": {
      "status": "NEW",
      "score": null,
      "sample_size": 0,
      "later_confirmed": 0,
      "false_or_materially_misleading": 0,
      "unresolved": 0
    }
  },
  {
    "schema_version": 1,
    "source_id": "SRC-MACROMICRO-AGSI",
    "name": "MacroMicro",
    "source_class": "S2",
    "source_type": "DATA_AGGREGATOR",
    "url": "https://en.macromicro.me/series/19145/eu-natural-gas-percent-of-full-working-gas-volume",
    "language": "en",
    "country": null,
    "published_at": null,
    "published_date": "2026-09-27",
    "publication_precision": "DATE_ONLY",
    "retrieved_at": "2026-09-27T12:19:44Z",
    "is_primary": false,
    "is_original": false,
    "evidence_family_id": "EF-AGSI-STORAGE",
    "relationship": "QUOTES_SOURCE",
    "availability": "ACCESSIBLE",
    "reputation": {
      "status": "NEW",
      "score": null,
      "sample_size": 0,
      "later_confirmed": 0,
      "false_or_materially_misleading": 0,
      "unresolved": 0
    }
  },
  {
    "schema_version": 1,
    "source_id": "SRC-GEF-ENERGY",
    "name": "Global Energy Flow",
    "source_class": "S2",
    "source_type": "SPECIALIST_ENERGY_INTELLIGENCE",
    "url": "https://global-energy-flow.com/",
    "language": "en",
    "country": null,
    "published_at": null,
    "published_date": "2026-09-26",
    "publication_precision": "DATE_ONLY",
    "retrieved_at": "2026-09-27T12:19:44Z",
    "is_primary": false,
    "is_original": true,
    "evidence_family_id": "EF-GEF-ENERGY",
    "relationship": "ORIGINAL",
    "availability": "ACCESSIBLE",
    "reputation": {
      "status": "NEW",
      "score": null,
      "sample_size": 0,
      "later_confirmed": 0,
      "false_or_materially_misleading": 0,
      "unresolved": 0
    }
  },
  {
    "schema_version": 1,
    "source_id": "SRC-REUTERS-DIESEL-SEP21",
    "name": "Reuters",
    "source_class": "S4",
    "source_type": "WIRE_SERVICE",
    "url": "https://www.reuters.com/business/energy/global-diesel-shortage-likely-last-into-2027-storage-tanks-drain-2026-09-21/",
    "language": "en",
    "country": null,
    "published_at": null,
    "published_date": "2026-09-21",
    "publication_precision": "DATE_ONLY",
    "retrieved_at": "2026-09-27T12:19:44Z",
    "is_primary": false,
    "is_original": true,
    "evidence_family_id": "EF-REUTERS-DIESEL",
    "relationship": "ORIGINAL",
    "availability": "ACCESSIBLE",
    "reputation": {
      "status": "NEW",
      "score": null,
      "sample_size": 0,
      "later_confirmed": 0,